"(Linked) Lifecycle_Profile_did_complete","(Linked) Lifecycle_Stage","create_on","description","module_type","ModuleTypeChecklist_list","ModuleTypeForm_Question"
"owner@riverbendhardware.com , contact@maplestreetbakery.com , info@heartlandautoservice.com , admin@prairieviewdental.com , office@summitridgebuild.com , pharmacist@cornerstonepharmacy.com , sales@lakesideoutdoor.com , support@heritageinsurancegroup.com , team@evergreenlandscape.com , care@northcountyvets.com , hello@bluehorizontech.com","1772310721342x205610653087564560","","Many successful transitions begin years before a sale. This resource explains how to identify and gradually mentor potential internal successors while your business is still growing.","URL","",""
"owner@riverbendhardware.com , contact@maplestreetbakery.com , info@heartlandautoservice.com , admin@prairieviewdental.com , office@summitridgebuild.com , pharmacist@cornerstonepharmacy.com , sales@lakesideoutdoor.com , support@heritageinsurancegroup.com , team@evergreenlandscape.com , care@northcountyvets.com , hello@bluehorizontech.com","1772310721342x205610653087564560","","If your business cannot operate without you for 30 days, it is not succession-ready. Use this checklist to begin reducing operational dependency on the current owner.","CHECKLIST","Document daily operating procedures , Assign second-in-command decision authority , Create written vendor relationship summaries , List all recurring passwords and systems access points , Draft a 30-day absence continuity plan , Identify at least one internal leadership candidate",""
"contact@maplestreetbakery.com , info@heartlandautoservice.com , admin@prairieviewdental.com , office@summitridgebuild.com , pharmacist@cornerstonepharmacy.com , sales@lakesideoutdoor.com , support@heritageinsurancegroup.com , team@evergreenlandscape.com , care@northcountyvets.com , hello@bluehorizontech.com","1772310721342x205610653087564560","","Clarifying your long-term intention reduces reactive decision-making later. This short reflection becomes part of your private succession file.","FORM","","In five years, who do you ideally want to own this business, and what conditions would make that transition successful?"
"owner@riverbendhardware.com , contact@maplestreetbakery.com , info@heartlandautoservice.com , admin@prairieviewdental.com , office@summitridgebuild.com , pharmacist@cornerstonepharmacy.com , sales@lakesideoutdoor.com , support@heritageinsurancegroup.com , team@evergreenlandscape.com , care@northcountyvets.com , hello@bluehorizontech.com","1772310721342x205610653087564560","Feb 28, 2026 11:39 pm","High-growth businesses that document systems early are significantly easier to transition later.","URL","",""
"contact@maplestreetbakery.com , admin@prairieviewdental.com , office@summitridgebuild.com , pharmacist@cornerstonepharmacy.com , sales@lakesideoutdoor.com , team@evergreenlandscape.com , care@northcountyvets.com","1772310813976x886933535573839700","Feb 28, 2026 11:42 pm","Ensure the business can operate during unexpected absence.","CHECKLIST","Identify acting decision-maker , Document financial account access , Outline payroll process , Compile vendor account information , Store legal documents securely",""
"owner@riverbendhardware.com , contact@maplestreetbakery.com , info@heartlandautoservice.com , admin@prairieviewdental.com , office@summitridgebuild.com , pharmacist@cornerstonepharmacy.com , sales@lakesideoutdoor.com , team@evergreenlandscape.com , care@northcountyvets.com","1772310813976x886933535573839700","Feb 28, 2026 11:44 pm","Even stable businesses benefit from understanding how valuation works long before transition.","URL","",""
"owner@riverbendhardware.com , contact@maplestreetbakery.com , info@heartlandautoservice.com , admin@prairieviewdental.com , office@summitridgebuild.com , pharmacist@cornerstonepharmacy.com , sales@lakesideoutdoor.com , team@evergreenlandscape.com , care@northcountyvets.com","1772310813976x886933535573839700","Feb 28, 2026 11:47 pm","Reflect on potential ownership transition timing without committing publicly.","FORM","","If you were to transition ownership within the next 10 years, what would need to be true first?"
"contact@maplestreetbakery.com , admin@prairieviewdental.com , office@summitridgebuild.com , pharmacist@cornerstonepharmacy.com , sales@lakesideoutdoor.com , team@evergreenlandscape.com , care@northcountyvets.com","1772310834611x936345282110342000","Feb 28, 2026 11:48 pm","Pre-Transition Documentation Audit","CHECKLIST","Up-to-date Financial Statements , Tax Returns Organized , Key Employee Role Clarity , SOPs Documented , Customer Concentration Analysis",""
"contact@maplestreetbakery.com , admin@prairieviewdental.com , pharmacist@cornerstonepharmacy.com , sales@lakesideoutdoor.com , team@evergreenlandscape.com , care@northcountyvets.com","1772310834611x936345282110342000","Feb 28, 2026 11:49 pm","Explore whether internal, family, or external successors are viable.","FORM","","Which successor pathway feels most realistic today (internal, family, external buyer), and why?"
"contact@maplestreetbakery.com , admin@prairieviewdental.com , pharmacist@cornerstonepharmacy.com , sales@lakesideoutdoor.com , team@evergreenlandscape.com , care@northcountyvets.com","1772310834611x936345282110342000","Feb 28, 2026 11:50 pm","Understanding financing structures can widen your pool of future successors.","URL","",""
"admin@prairieviewdental.com , pharmacist@cornerstonepharmacy.com , sales@lakesideoutdoor.com , team@evergreenlandscape.com , care@northcountyvets.com","1772310866717x829775562345005400","Feb 28, 2026 11:51 pm","Prepare a structured packet to support a smooth ownership transition.","CHECKLIST","3 Years Financial Statements , Vendor Contracts , Customer Retention Data , Lease Or Property Documentation , Employee Roster And Tenure",""
"pharmacist@cornerstonepharmacy.com , care@northcountyvets.com","1772310866717x829775562345005400","Feb 28, 2026 11:51 pm","Plan communication to employees, customers, and vendors.","FORM","","How and when would you communicate a transition to employees and customers to maintain stability?"
"contact@maplestreetbakery.com , pharmacist@cornerstonepharmacy.com , care@northcountyvets.com","1772310866717x829775562345005400","Feb 28, 2026 11:53 pm","Review legal frameworks that support structured ownership transitions.","URL","",""
